college_code,college_name,city,district,autonomous,college_type,university,naac_grade,nirf_rank,website
E001,University Visvesvaraya College of Engineering,Bengaluru,Bengaluru Urban,TRUE,University,,,,
E002,Govt. S K S J T Institute of Engineering,Bengaluru,Bengaluru Urban,FALSE,Government,,,,
E003,B M S College of Engineering,Bengaluru,Bengaluru Urban,TRUE,Private,,,,
E004,Dr. Ambedkar Institute of Technology,Bengaluru,Bengaluru Urban,TRUE,Private,,,,
E005,R. V. College of Engineering,Bengaluru,Bengaluru Urban,TRUE,Private,,,,
E006,M S Ramaiah Institute of Technology,Bengaluru,Bengaluru Urban,TRUE,Private,,,,
E007,Dayananda Sagar College of Engineering,Bengaluru,Bengaluru Urban,TRUE,Private,,,,
E008,Bangalore Institute of Technology,Bengaluru,Bengaluru Urban,FALSE,Private,,,,
E009,PES University,Bengaluru,Bengaluru Urban,FALSE,University,,,,
E011,M V J College of Engineering,Bengaluru,Bengaluru Urban,FALSE,Private,,,,
E012,Sir M. Visvesvaraya Institute of Technology,Bengaluru,Bengaluru Urban,FALSE,Private,,,,
E013,Ghousia Engineering College,Ramanagara,Ramanagara,FALSE,Private,,,,
E014,S J C Institute of Technology,Chikkaballapur,Chikkaballapur,FALSE,Private,,,,
E015,Dr. T. Thimmaiah Institute of Technology,Bangarapet,Kolar,FALSE,Private,,,,
E016,Siddaganga Institute of Technology,Tumakuru,Tumakuru,TRUE,Private,,,,
E017,Sri Siddhartha Institute of Technology,Tumakuru,Tumakuru,TRUE,Private,,,,
E018,Kalpatharu Institute of Technology,Tiptur,Tumakuru,FALSE,Private,,,,
E021,Sri Jayachamarajendra College of Engineering,Mysuru,Mysuru,TRUE,Private,,,,
E022,The National Institute of Engineering (South Campus),Mysuru,Mysuru,TRUE,Private,,,,
E023,P E S College of Engineering,Mandya,Mandya,TRUE,Private,,,,
E024,Malnad College of Engineering,Hassan,Hassan,TRUE,Private,,,,
E028,Tontadarya College of Engineering,Gadag,Gadag,FALSE,Private,,,,
E029,Maratha Mandal Engineering College,Belagavi,Belagavi,FALSE,Private,,,,
E031,B V V Sangha Basaveshwara Engineering College,Bagalkot,Bagalkot,TRUE,Private,,,,
E032,R T E Society's Rural Engineering College,Hulkoti,Gadag,FALSE,Private,,,,
E033,Sri Taralabalu Jagadguru Institute of Technology,Ranebennur,Haveri,FALSE,Private,,,,
E034,SDM College of Engineering,Dharwad,Dharwad,TRUE,Private,,,,
E035,Anjuman Institute of Technology & Management,Bhatkal,Uttara Kannada,FALSE,Private,,,,
E036,K L E Technological University (Belgaum Campus),Belagavi,Belagavi,FALSE,University,,,,
E037,K L S Gogte Institute of Technology,Belagavi,Belagavi,TRUE,Private,,,,
E038,BLDEA's V P Dr P G Hallakatti College of Engineering & Technology,Vijayapura,Vijayapura,FALSE,Private,,,,
E040,Hira Sugar Institute of Technology,Nidasoshi,Belagavi,FALSE,Private,,,,
E041,P D A College of Engineering,Kalaburagi,Kalaburagi,TRUE,Private,,,,
E042,Khaja Bandanawaz University,Kalaburagi,Kalaburagi,FALSE,University,,,,
E043,Gurunanak Dev Engineering College,Bidar,Bidar,FALSE,Private,,,,
E044,Bheemanna Khandre Institute of Technology,Bhalki,Bidar,FALSE,Private,,,,
E045,Rao Bahadur Y. Mahabaleswarappa Engineering College,Ballari,Ballari,FALSE,Private,,,,
E046,H K E Society's Sir M Visvesvaraya College of Engineering,Kalaburagi,Kalaburagi,FALSE,Private,,,,
E047,Malnad College of Engineering,Hassan,Hassan,TRUE,Private,,,,
E048,B M S College of Engineering,Bengaluru,Bengaluru Urban,TRUE,Private,,,,
E049,B V V Sangha Basaveshwara Engineering College,Bagalkot,Bagalkot,TRUE,Private,,,,
E054,K V G College of Engineering,Sullia,Dakshina Kannada,FALSE,Private,,,,
E055,P A College of Engineering,Mangaluru,Dakshina Kannada,FALSE,Private,,,,
E056,The National Institute of Engineering (South Campus),Mysuru,Mysuru,TRUE,Private,,,,
E057,JSS Science and Technology University,Mysuru,Mysuru,FALSE,University,,,,
E058,P E S College of Engineering,Mandya,Mandya,TRUE,Private,,,,
E059,P D A College of Engineering,Kalaburagi,Kalaburagi,TRUE,Private,,,,
E060,Dr. Ambedkar Institute of Technology,Bengaluru,Bengaluru Urban,TRUE,Private,,,,
E061,University B D T College of Engineering,Davanagere,Davanagere,FALSE,Constituent,,,,
E062,Bapuji Institute of Engineering & Technology,Davanagere,Davanagere,FALSE,Private,,,,
E063,S J M Institute of Technology,Chitradurga,Chitradurga,FALSE,Private,,,,
E064,Adhichunchanagiri Institute of Technology,Chikkamagaluru,Chikkamagaluru,FALSE,Private,,,,
E065,Jawaharlal Nehru New College of Engineering,Shivamogga,Shivamogga,FALSE,Private,,,,
E066,University B D T College of Engineering (H. Gov),Davanagere,Davanagere,FALSE,Constituent,,,,
E070,Bahubali College of Engineering,Shravanabelagola,Hassan,FALSE,Private,,,,
E071,Vidya Vardhaka College of Engineering,Mysuru,Mysuru,TRUE,Private,,,,
E075,Ballari Institute of Technology & Management,Ballari,Ballari,TRUE,Private,,,,
E076,Proudadevaraya Institute of Technology,Hosapete,Vijayanagara,FALSE,Private,,,,
E077,Vidya Vikas Institute of Engineering & Technology,Mysuru,Mysuru,FALSE,Private,,,,
E078,"The Oxford College of Engineering, Bangalore HOSUR ROAD,BOMMANAHALLI,BANGALORE",Bengaluru,Bengaluru Urban,FALSE,Private,,,,
E079,Acharya Institute of Technology,Bengaluru,Bengaluru Urban,FALSE,Private,,,,
E081,Sri Siddhartha School of Engineering,Tumakuru,Tumakuru,FALSE,Private,,,,
E082,J S S Academy of Technical Education,Bengaluru,Bengaluru Urban,FALSE,Private,,,,
E083,H K B K College of Engineering,Bengaluru,Bengaluru Urban,FALSE,Private,,,,
E085,APS College of Engineering,Bengaluru,Bengaluru Urban,FALSE,Private,,,,
E086,Sri Sairam College of Engineering,Bengaluru,Bengaluru Urban,FALSE,Private,,,,
E087,Vivekananda Institute of Technology,Bengaluru,Bengaluru Urban,FALSE,Private,,,,
E090,Sri Revana Siddeswara Institute of Technology,Bengaluru,Bengaluru Urban,FALSE,Private,,,,
E091,K S Institute of Technology,Bengaluru,Bengaluru Urban,FALSE,Private,,,,
E092,Vemana Institute of Technology,Bengaluru,Bengaluru Urban,FALSE,Private,,,,
E093,Basavakalyana Engineering College,Basavakalyan,Bidar,FALSE,Private,,,,
E094,Coorg Institute of Technology,Ponnampet,Kodagu,FALSE,Private,,,,
E095,AMC Engineering College,Bengaluru,Bengaluru Urban,FALSE,Private,,,,
E096,East Point College of Engineering & Technology,Bengaluru,Bengaluru Urban,FALSE,Private,,,,
E097,C M R Institute of Technology,Bengaluru,Bengaluru Urban,TRUE,Private,,,,
E098,Atria Institute of Technology,Bengaluru,Bengaluru Urban,FALSE,Private,,,,
E099,New Horizon College of Engineering,Bengaluru,Bengaluru Urban,TRUE,Private,,,,
E100,K N S Institute of Technology,Bengaluru,Bengaluru Urban,FALSE,Private,,,,
E101,Channabasaveshwara Institute of Technology,Gubbi,Tumakuru,FALSE,Private,,,,
E102,Don Bosco Institute of Technology,Bengaluru,Bengaluru Urban,FALSE,Private,,,,
E103,Global Academy of Technology,Bengaluru,Bengaluru Urban,TRUE,Private,,,,
E104,Nagarjuna College of Engineering & Technology,Bengaluru,Bengaluru Rural,TRUE,Private,,,,
E106,East West Institute of Technology,Bengaluru,Bengaluru Urban,FALSE,Private,,,,
E107,B N M Institute of Technology,Bengaluru,Bengaluru Urban,TRUE,Private,,,,
E108,Sapthagiri NPS University,Bengaluru,Bengaluru Urban,FALSE,University,,,,
E109,City Engineering College,Bengaluru,Bengaluru Urban,FALSE,Private,,,,
E111,Sri Venkateshwara College of Engineering,Bengaluru,Bengaluru Urban,FALSE,Private,,,,
E112,Sri Krishna Institute of Technology,Bengaluru,Bengaluru Urban,FALSE,Private,,,,
E113,Sambhram Institute of Technology,Bengaluru,Bengaluru Urban,FALSE,Private,,,,
E114,G M Institute of Technology,Davanagere,Davanagere,FALSE,Private,,,,
E115,S J B Institute of Technology,Bengaluru,Bengaluru Urban,FALSE,Private,,,,
E116,R L Jalappa Institute of Technology,Doddaballapur,Bengaluru Rural,FALSE,Private,,,,
E118,RNS Institute of Technology,Bengaluru,Bengaluru Urban,TRUE,Private,,,,
E119,K C T Engineering College,Kalaburagi,Kalaburagi,FALSE,Private,,,,
E120,Jnanavikasa Institute of Technology,Bidadi,Ramanagara,FALSE,Private,,,,
E121,Vivekananda College of Engineering Technology,Puttur,Dakshina Kannada,FALSE,Private,,,,
E123,Canara Engineering College,Mangaluru,Dakshina Kannada,FALSE,Private,,,,
E124,Rajiv Gandhi Institute of Technology,Bengaluru,Bengaluru Urban,FALSE,Private,,,,
E126,B M S Institute of Technology & Management,Bengaluru,Bengaluru Urban,TRUE,Private,,,,
E127,M S Engineering College,Bengaluru,Bengaluru Rural,FALSE,Private,,,,
E128,Sharanbasava University,Kalaburagi,Kalaburagi,FALSE,University,,,,
E129,St. Joseph Engineering College,Mangaluru,Dakshina Kannada,TRUE,Private,,,,
E130,Shridevi Institute of Engineering & Technology,Tumakuru,Tumakuru,FALSE,Private,,,,
E132,Secab Institute of Engineering & Technology,Vijayapura,Vijayapura,FALSE,Private,,,,
E133,G S S S Institute of Engineering & Technology for Women,Mysuru,Mysuru,FALSE,Private,,,,
E134,Smt. Kamala & Sri Venkappa M Agadi College of Engineering & Technology,Laxmeshwar,Gadag,FALSE,Private,,,,
E135,K L S Viswanathrao Deshpande Institute of Technology,Haliyal,Uttara Kannada,FALSE,Private,,,,
E136,Moodalakatte Institute of Technology,Kundapura,Udupi,FALSE,Private,,,,
E139,Impact College of Engineering & Applied Sciences,Bengaluru,Bengaluru Urban,FALSE,Private,,,,
E141,PES University (Electronic City Campus),Bengaluru,Bengaluru Urban,FALSE,University,,,,
E142,Adhichunchanagiri University,B G Nagara,Mandya,FALSE,University,,,,
E144,Srinivas Institute of Technology,Mangaluru,Dakshina Kannada,FALSE,Private,,,,
E145,Rajarajeswari College of Engineering,Bengaluru,Bengaluru Urban,FALSE,Private,,,,
E146,Shreedevi Institute of Technology,Mangaluru,Dakshina Kannada,FALSE,Private,,,,
E147,T John Institute of Technology,Bengaluru,Bengaluru Urban,FALSE,Private,,,,
E149,Cambridge Institute of Technology,Bengaluru,Bengaluru Urban,FALSE,Private,,,,
E150,P E S Institute of Technology & Management,Shivamogga,Shivamogga,FALSE,Private,,,,
E151,Mangalore Institute of Technology & Engineering,Moodabidri,Dakshina Kannada,TRUE,Private,,,,
E152,S D M Institute of Technology,Ujire,Dakshina Kannada,FALSE,Private,,,,
E153,S E A College of Engineering & Technology,Bengaluru,Bengaluru Urban,FALSE,Private,,,,
E154,"Government Engineering College, Chamarajanagara",Chamarajanagar,Chamarajanagar,FALSE,Government,,,,
E155,"Government Engineering College, Hassan",Hassan,Hassan,FALSE,Government,,,,
E156,"Government Engineering College, K R Pet",Krishnarajapet,Mandya,FALSE,Government,,,,
E157,"Government Engineering College, Ramanagaram",Ramanagara,Ramanagara,FALSE,Government,,,,
E158,Maharaja Institute of Technology Mysore,Mysuru,Mandya,FALSE,Private,,,,
E159,Karavali Institute of Technology,Mangaluru,Dakshina Kannada,FALSE,Private,,,,
E160,Sahyadri College of Engineering & Management,Mangaluru,Dakshina Kannada,TRUE,Private,,,,
E161,"Government Engineering College, Kushalanagar",Kushalnagar,Kodagu,FALSE,Government,,,,
E162,"Government Engineering College, Raichur",Raichur,Raichur,FALSE,Government,,,,
E163,"Government Engineering College, Haveri",Haveri,Haveri,FALSE,Government,,,,
E164,"Government Engineering College, Hoovina Hadagali",Hoovina Hadagali,Vijayanagara,FALSE,Government,,,,
E165,Yenepoya Institute of Technology,Moodabidri,Dakshina Kannada,FALSE,Private,,,,
E167,K L E S K L E College of Engineering & Technology,Chikkodi,Belagavi,FALSE,Private,,,,
E168,Amrutha Institute of Engineering & Management Science,Bidadi,Ramanagara,FALSE,Private,,,,
E169,Alva's Institute of Engineering & Technology,Moodabidri,Dakshina Kannada,FALSE,Private,,,,
E171,Brindavan College of Engineering,Bengaluru,Bengaluru Urban,FALSE,Private,,,,
E172,R R Institute of Technology,Bengaluru,Bengaluru Urban,FALSE,Private,,,,
E173,Sai Vidya Institute of Technology,Bengaluru,Bengaluru Urban,FALSE,Private,,,,
E174,Dr. Sri Sri Sri Shivakumara Mahaswamyji College of Engineering,Nelamangala,Bengaluru Rural,FALSE,Private,,,,
E175,S S E T S S G Balekundri Institute of Technology,Belagavi,Belagavi,FALSE,Private,,,,
E176,Navodaya Institute of Technology,Raichur,Raichur,FALSE,Private,,,,
E177,Rajeev Institute of Technology,Hassan,Hassan,FALSE,Private,,,,
E178,The National Institute of Engineering (North Campus),Mysuru,Mysuru,TRUE,Private,,,,
E180,Beary's Institute of Technology,Mangaluru,Dakshina Kannada,FALSE,Private,,,,
E181,Sri Basaveswara Institute of Technology,Tumakuru,Tumakuru,FALSE,Private,,,,
E184,C Byre Gowda Institute of Technology,Kolar,Kolar,FALSE,Private,,,,
E185,Angadi Institute of Technology and Management,Belagavi,Belagavi,FALSE,Private,,,,
E186,ACS College of Engineering,Bengaluru,Bengaluru Urban,FALSE,Private,,,,
E188,Vijaya Vittala Institute of Technology,Bengaluru,Bengaluru Urban,FALSE,Private,,,,
E189,NAVKIS College of Engineering,Hassan,Hassan,FALSE,Private,,,,
E191,Akshaya Institute of Technology,Tumakuru,Tumakuru,FALSE,Private,,,,
E193,Srinivas University,Mangaluru,Dakshina Kannada,FALSE,University,,,,
E194,"Government Engineering College, Karwar",Karwar,Uttara Kannada,FALSE,Government,,,,
E196,Jain College of Engineering,Belagavi,Belagavi,FALSE,Private,,,,
E197,Veerappa Nisty Engineering College,Shorapur,Yadgir,FALSE,Private,,,,
E198,Sharanbasava University (Exclusively for Women),Kalaburagi,Kalaburagi,FALSE,University,,,,
E199,AGM Rural Engineering College,Navalgund,Dharwad,FALSE,Private,,,,
E201,Gopalan College of Engineering & Management,Bengaluru,Bengaluru Urban,FALSE,Private,,,,
E202,Sampoorna Group of Institutions,Channapatna,Ramanagara,FALSE,Private,,,,
E203,K S School of Engineering & Management,Bengaluru,Bengaluru Urban,FALSE,Private,,,,
E204,Bangalore Technological Institute,Bengaluru,Bengaluru Urban,TRUE,Private,,,,
E205,ATME College of Engineering,Mysuru,Mysuru,FALSE,Private,,,,
E206,Shri Madhwa Vadiraja Institute of Technology and Management,Bantakal,Udupi,FALSE,Private,,,,
E207,V S M's Somashekhar R Kothiwale Institute of Technology,Nipani,Belagavi,FALSE,Private,,,,
E209,Jyothi Institute of Technology,Bengaluru,Bengaluru Urban,FALSE,Private,,,,
E210,G Madegowda Institute of Technology,Maddur,Mandya,FALSE,Private,,,,
E211,Jain Institute of Technology,Davanagere,Davanagere,FALSE,Private,,,,
E212,Dayananda Sagar Academy of Technology & Management,Bengaluru,Bengaluru Urban,TRUE,Private,,,,
E213,Lingarajappa Engineering College,Bidar,Bidar,FALSE,Private,,,,
E216,Shetty Institute of Technology,Kalaburagi,Kalaburagi,FALSE,Private,,,,
E220,Alliance University,Bengaluru,Bengaluru Urban,FALSE,University,,,,
E221,Biluru Gurubasava Mahaswamiji Institute of Technology,Mudhol,Bagalkot,FALSE,Private,,,,
E222,Cambridge Institute of Technology (North Campus),Bengaluru,Bengaluru Urban,FALSE,Private,,,,
E225,SJB School of Architecture & Planning,Bengaluru,Bengaluru Urban,FALSE,Private,,,,
E227,Cauvery Institute of Technology,Mandya,Mandya,FALSE,Private,,,,
E232,REVA University,Bengaluru,Bengaluru Urban,FALSE,University,,,,
E235,M S Ramaiah University of Applied Sciences,Bengaluru,Bengaluru Urban,FALSE,University,,,,
E237,Presidency University,Bengaluru,Bengaluru Urban,FALSE,University,,,,
E238,Mysuru Royal Institute of Technology,Mandya,Mandya,FALSE,Private,,,,
E239,East West College of Engineering,Bengaluru,Bengaluru Urban,FALSE,Private,,,,
E240,Dayananda Sagar University,Bengaluru,Bengaluru Urban,FALSE,University,,,,
E241,KLE Technological University,Hubballi,Dharwad,FALSE,University,,,,
E252,Mysore College of Engineering and Management,Mysuru,Mysuru,FALSE,Private,,,,
E254,A J Institute of Engineering and Technology,Mangaluru,Dakshina Kannada,FALSE,Private,,,,
E255,Gandhi Institute of Technology and Management (GITAM),Bengaluru,Bengaluru Rural,FALSE,University,,,,
E256,Rai Technological University,Doddaballapur,Bengaluru Rural,FALSE,University,,,,
E257,CMR University,Bengaluru,Bengaluru Urban,FALSE,University,,,,
E258,Maharaja Institute of Technology Tandavapura,Nanjangud,Mysuru,FALSE,Private,,,,
E259,Sir M V School of Architecture,Bengaluru,Bengaluru Urban,FALSE,Private,,,,
E263,"School of Planning and Architecture, University of Mysore",Mysuru,Mysuru,FALSE,Constituent,,,,
E264,Basav Engineering School of Technology,Zalki,Vijayapura,FALSE,Private,,,,
E265,Jain College of Engineering and Technology,Hubballi,Dharwad,FALSE,Private,,,,
E266,BMS College of Architecture,Bengaluru,Bengaluru Urban,TRUE,Private,,,,
E269,Jain College of Engineering and Research,Belagavi,Belagavi,FALSE,Private,,,,
E272,"Government Engineering College, Talakal",Talakal,Koppal,FALSE,Government,,,,
E273,"Government Engineering College, Gangavathi",Gangavathi,Koppal,FALSE,Government,,,,
E274,"Government Engineering College, Mosale Hosahalli",Mosalehosahalli,Hassan,FALSE,Government,,,,
E275,R V Institute of Technology and Management,Bengaluru,Bengaluru Urban,FALSE,Private,,,,
E278,Visvesvaraya Technological University (Muddenahalli Campus),Muddenahalli,Chikkaballapur,FALSE,Constituent,,,,
E279,Visvesvaraya Technological University (Belagavi Campus),Belagavi,Belagavi,FALSE,Constituent,,,,
E281,"Government Engineering College, Challakere",Challakere,Chitradurga,FALSE,Government,,,,
E283,University of Mysuru (B N Bahadur Institute of Management Sciences),Mysuru,Mysuru,FALSE,Constituent,,,,
E284,Sri Jayachamarajendra College of Engineering,Mysuru,Mysuru,TRUE,Private,,,,
E285,RV University,Bengaluru,Bengaluru Urban,FALSE,University,,,,
E286,BGS College of Engineering & Technology,Bengaluru,Bengaluru Urban,FALSE,Private,,,,
E287,Vidyashilp University,Bengaluru,Bengaluru Urban,FALSE,University,,,,
E288,Garden City University,Bengaluru,Bengaluru Urban,FALSE,University,,,,
E289,Visvesvaraya Technological University (Kalaburagi),Kalaburagi,Kalaburagi,FALSE,Constituent,,,,
E290,Visvesvaraya Technological University (Mysuru),Mysuru,Mysuru,FALSE,Constituent,,,,
E291,"Government Engineering College, Naragund",Nargund,Gadag,FALSE,Government,,,,
E292,"Government Engineering College, Mailur",Bidar,Bidar,FALSE,Government,,,,
E297,Aditya College of Engineering and Technology,Bengaluru,Bengaluru Urban,FALSE,Private,,,,
E299,Ghousia Institute of Technology for Women,Ramanagara,Ramanagara,FALSE,Private,,,,
E300,Akash Institute of Engineering and Technology,Bengaluru,Bengaluru Urban,FALSE,Private,,,,
E301,Kishkinda University,Ballari,Ballari,FALSE,University,,,,
E302,Amity University,Bengaluru,Bengaluru Urban,FALSE,University,,,,
E303,GM University,Davanagere,Davanagere,FALSE,University,,,,
E304,Anuvartik Mirji Bharatesh Institute of Technology,Belagavi,Belagavi,FALSE,Private,,,,
E305,Dr H N National College of Engineering,Bengaluru,Bengaluru Urban,FALSE,Private,,,,
E306,The Chanakya University,Bengaluru,Bengaluru Rural,FALSE,University,,,,
E307,Seshadripuram Institute of Technology,Bengaluru,Bengaluru Urban,FALSE,Private,,,,
E308,"Constituent College of VTU, Chintamani",Chintamani,Chikkaballapur,FALSE,Constituent,,,,
E309,"Constituent College of VTU, Chintamani",Chintamani,Chikkaballapur,FALSE,Constituent,,,,
E310,"Government Engineering College, Arasikere",Arasikere,Hassan,FALSE,Government,,,,
E311,Rathinam Institute of Technology,Bengaluru,Bengaluru Urban,FALSE,Private,,,,
E312,New Ebenezer Institute of Technology,Bengaluru,Bengaluru Urban,FALSE,Private,,,,
E313,Harsha Institute of Technology,Bengaluru,Bengaluru Urban,FALSE,Private,,,,
E314,Cauvery College of Engineering,Gonikoppal,Kodagu,FALSE,Private,,,,
E315,"VTU Constituent Engineering College, Gokak",Gokak,Belagavi,FALSE,Constituent,,,,
